21:11:00.807983 STP 802.1d, Config, Flags [none], bridge-id 8001.00:1b:2b:22:c9:80.801a, length 43
21:11:00.957961 IP adsl-99-99-99-1.dsl.lsan03.sbcglobal.net.49060 > 192.168.160.2.4789: VXLAN, flags [I] (0x08), vni 42
ARP, Request who-has 1.1.1.116 tell 1.1.1.22, length 28
21:11:00.959616 IP adsl-99-99-99-2.dsl.lsan03.sbcglobal.net.51752 > adsl-99-99-99-1.dsl.lsan03.sbcglobal.net.4789: VXLAN, flags [I] (0x08), vni 42
ARP, Reply 1.1.1.116 is-at 52:54:00:f1:5c:fd (oui Unknown), length 28
21:11:00.959723 IP adsl-99-99-99-1.dsl.lsan03.sbcglobal.net > adsl-99-99-99-2.dsl.lsan03.sbcglobal.net: ICMP adsl-99-99-99-1.dsl.lsan03.sbcglobal.net udp port 4789 unreachable, length 86
21:11:01.089466 IP 0.0.0.0.bootpc > 255.255.255.255.bootps: BOOTP/DHCP, Request from 52:54:00:80:cc:b9 (oui Unknown), length 300
21:11:01.960596 IP adsl-99-99-99-1.dsl.lsan03.sbcglobal.net.49060 > 192.168.160.2.4789: VXLAN, flags [I] (0x08), vni 42
ARP, Request who-has 1.1.1.116 tell 1.1.1.22, length 28
21:11:01.962305 IP adsl-99-99-99-2.dsl.lsan03.sbcglobal.net.51752 > adsl-99-99-99-1.dsl.lsan03.sbcglobal.net.4789: VXLAN, flags [I] (0x08), vni 42
ARP, Reply 1.1.1.116 is-at 52:54:00:f1:5c:fd (oui Unknown), length 28
21:11:01.962425 IP adsl-99-99-99-1.dsl.lsan03.sbcglobal.net > adsl-99-99-99-2.dsl.lsan03.sbcglobal.net: ICMP adsl-99-99-99-1.dsl.lsan03.sbcglobal.net udp port 4789 unreachable, length 86
21:11:02.812830 STP 802.1d, Config, Flags [none], bridge-id 8001.00:1b:2b:22:c9:80.801a, length 43
21:11:02.962697 IP adsl-99-99-99-1.dsl.lsan03.sbcglobal.net.49060 > 192.168.160.2.4789: VXLAN, flags [I] (0x08), vni 42
ARP, Request who-has 1.1.1.116 tell 1.1.1.22, length 28
21:11:02.964453 IP adsl-99-99-99-2.dsl.lsan03.sbcglobal.net.51752 > adsl-99-99-99-1.dsl.lsan03.sbcglobal.net.4789: VXLAN, flags [I] (0x08), vni 42
ARP, Reply 1.1.1.116 is-at 52:54:00:f1:5c:fd (oui Unknown), length 28
21:11:02.964574 IP adsl-99-99-99-1.dsl.lsan03.sbcglobal.net > adsl-99-99-99-2.dsl.lsan03.sbcglobal.net: ICMP adsl-99-99-99-1.dsl.lsan03.sbcglobal.net udp port 4789 unreachable, length 86
21:11:04.533129 IP 0.0.0.0.bootpc > 255.255.255.255.bootps: BOOTP/DHCP, Request from 44:a8:42:41:b3:cb (oui Unknown), length 300
21:11:04.817901 STP 802.1d, Config, Flags [none], bridge-id 8001.00:1b:2b:22:c9:80.801a, length 43
21:11:04.962307 IP adsl-99-99-99-1.dsl.lsan03.sbcglobal.net.49060 > 192.168.160.2.4789: VXLAN, flags [I] (0x08), vni 42
ARP, Request who-has 1.1.1.116 tell 1.1.1.22, length 28
21:11:04.964214 IP adsl-99-99-99-2.dsl.lsan03.sbcglobal.net.51752 > adsl-99-99-99-1.dsl.lsan03.sbcglobal.net.4789: VXLAN, flags [I] (0x08), vni 42
ARP, Reply 1.1.1.116 is-at 52:54:00:f1:5c:fd (oui Unknown), length 28
21:11:04.964340 IP adsl-99-99-99-1.dsl.lsan03.sbcglobal.net > adsl-99-99-99-2.dsl.lsan03.sbcglobal.net: ICMP adsl-99-99-99-1.dsl.lsan03.sbcglobal.net udp port 4789 unreachable, length 86
21:11:05.619370 IP 0.0.0.0.bootpc > 255.255.255.255.bootps: BOOTP/DHCP, Request from 52:54:00:c5:1b:49 (oui Unknown), length 300
21:11:05.964628 IP adsl-99-99-99-1.dsl.lsan03.sbcglobal.net.49060 > 192.168.160.2.4789: VXLAN, flags [I] (0x08), vni 42
ARP, Request who-has 1.1.1.116 tell 1.1.1.22, length 28
21:11:05.966448 IP adsl-99-99-99-2.dsl.lsan03.sbcglobal.net.51752 > adsl-99-99-99-1.dsl.lsan03.sbcglobal.net.4789: VXLAN, flags [I] (0x08), vni 42
ARP, Reply 1.1.1.116 is-at 52:54:00:f1:5c:fd (oui Unknown), length 28
21:11:05.966568 IP adsl-99-99-99-1.dsl.lsan03.sbcglobal.net > adsl-99-99-99-2.dsl.lsan03.sbcglobal.net: ICMP adsl-99-99-99-1.dsl.lsan03.sbcglobal.net udp port 4789 unreachable, length 86
21:11:06.411027 IP 0.0.0.0.bootpc > 255.255.255.255.bootps: BOOTP/DHCP, Request from 52:54:00:71:1f:be (oui Unknown), length 300
21:11:06.825550 STP 802.1d, Config, Flags [none], bridge-id 8001.00:1b:2b:22:c9:80.801a, length 43
21:11:06.966659 IP adsl-99-99-99-1.dsl.lsan03.sbcglobal.net.49060 > 192.168.160.2.4789: VXLAN, flags [I] (0x08), vni 42
ARP, Request who-has 1.1.1.116 tell 1.1.1.22, length 28
21:11:06.968426 IP adsl-99-99-99-2.dsl.lsan03.sbcglobal.net.51752 > adsl-99-99-99-1.dsl.lsan03.sbcglobal.net.4789: VXLAN, flags [I] (0x08), vni 42
ARP, Reply 1.1.1.116 is-at 52:54:00:f1:5c:fd (oui Unknown), length 28
21:11:06.968535 IP adsl-99-99-99-1.dsl.lsan03.sbcglobal.net > adsl-99-99-99-2.dsl.lsan03.sbcglobal.net: ICMP adsl-99-99-99-1.dsl.lsan03.sbcglobal.net udp port 4789 unreachable, length 86
21:11:07.884985 IP 0.0.0.0.bootpc > 255.255.255.255.bootps: BOOTP/DHCP, Request from 52:54:00:80:cc:b9 (oui Unknown), length 300
21:11:08.827774 STP 802.1d, Config, Flags [none], bridge-id 8001.00:1b:2b:22:c9:80.801a, length 43
21:11:08.966243 IP adsl-99-99-99-1.dsl.lsan03.sbcglobal.net.49060 > 192.168.160.2.4789: VXLAN, flags [I] (0x08), vni 42
ARP, Request who-has 1.1.1.116 tell 1.1.1.22, length 28
21:11:08.967906 IP adsl-99-99-99-2.dsl.lsan03.sbcglobal.net.51752 > adsl-99-99-99-1.dsl.lsan03.sbcglobal.net.4789: VXLAN, flags [I] (0x08), vni 42
ARP, Reply 1.1.1.116 is-at 52:54:00:f1:5c:fd (oui Unknown), length 28
21:11:08.968029 IP adsl-99-99-99-1.dsl.lsan03.sbcglobal.net > adsl-99-99-99-2.dsl.lsan03.sbcglobal.net: ICMP adsl-99-99-99-1.dsl.lsan03.sbcglobal.net udp port 4789 unreachable, length 86
21:11:32.886414 STP 802.1d, Config, Flags [none], bridge-id 8001.00:1b:2b:22:c9:80.801a, length 43
21:11:32.984165 IP adsl-99-99-99-1.dsl.lsan03.sbcglobal.net.49060 > 192.168.160.2.4789: VXLAN, flags [I] (0x08), vni 42
ARP, Request who-has 1.1.1.116 tell 1.1.1.22, length 28
21:11:32.985956 IP adsl-99-99-99-2.dsl.lsan03.sbcglobal.net.51752 > adsl-99-99-99-1.dsl.lsan03.sbcglobal.net.4789: VXLAN, flags [I] (0x08), vni 42
ARP, Reply 1.1.1.116 is-at 52:54:00:f1:5c:fd (oui Unknown), length 28
21:11:32.986087 IP adsl-99-99-99-1.dsl.lsan03.sbcglobal.net > adsl-99-99-99-2.dsl.lsan03.sbcglobal.net: ICMP adsl-99-99-99-1.dsl.lsan03.sbcglobal.net udp port 4789 unreachable, length 86
21:11:33.629177 IP 0.0.0.0.bootpc > 255.255.255.255.bootps: BOOTP/DHCP, Request from 52:54:00:0a:b0:7b (oui Unknown), length 294
21:11:33.984677 IP adsl-99-99-99-1.dsl.lsan03.sbcglobal.net.49060 > 192.168.160.2.4789: VXLAN, flags [I] (0x08), vni 42
ARP, Request who-has 1.1.1.116 tell 1.1.1.22, length 28
21:11:33.986735 IP adsl-99-99-99-2.dsl.lsan03.sbcglobal.net.51752 > adsl-99-99-99-1.dsl.lsan03.sbcglobal.net.4789: VXLAN, flags [I] (0x08), vni 42
ARP, Reply 1.1.1.116 is-at 52:54:00:f1:5c:fd (oui Unknown), length 28
21:11:33.986910 IP adsl-99-99-99-1.dsl.lsan03.sbcglobal.net > adsl-99-99-99-2.dsl.lsan03.sbcglobal.net: ICMP adsl-99-99-99-1.dsl.lsan03.sbcglobal.net udp port 4789 unreachable, length 86
21:11:34.891227 STP 802.1d, Config, Flags [none], bridge-id 8001.00:1b:2b:22:c9:80.801a, length 43
21:11:34.986600 IP adsl-99-99-99-1.dsl.lsan03.sbcglobal.net.49060 > 192.168.160.2.4789: VXLAN, flags [I] (0x08), vni 42
ARP, Request who-has 1.1.1.116 tell 1.1.1.22, length 28
21:11:34.988384 IP adsl-99-99-99-2.dsl.lsan03.sbcglobal.net.51752 > adsl-99-99-99-1.dsl.lsan03.sbcglobal.net.4789: VXLAN, flags [I] (0x08), vni 42
ARP, Reply 1.1.1.116 is-at 52:54:00:f1:5c:fd (oui Unknown), length 28
21:11:34.988499 IP adsl-99-99-99-1.dsl.lsan03.sbcglobal.net > adsl-99-99-99-2.dsl.lsan03.sbcglobal.net: ICMP adsl-99-99-99-1.dsl.lsan03.sbcglobal.net udp port 4789 unreachable, length 86
21:11:35.334995 IP 0.0.0.0.bootpc > 255.255.255.255.bootps: BOOTP/DHCP, Request from 52:54:00:ad:24:f2 (oui Unknown), length 300
21:11:35.988904 ARP, Request who-has adsl-99-99-99-2.dsl.lsan03.sbcglobal.net tell adsl-99-99-99-1.dsl.lsan03.sbcglobal.net, length 28
21:11:35.989377 ARP, Reply adsl-99-99-99-2.dsl.lsan03.sbcglobal.net is-at 52:54:00:5e:a4:6d (oui Unknown), length 46
21:11:36.857970 IP 0.0.0.0.bootpc > 255.255.255.255.bootps: BOOTP/DHCP, Request from 52:54:00:c5:1b:49 (oui Unknown), length 300
21:11:36.899516 STP 802.1d, Config, Flags [none], bridge-id 8001.00:1b:2b:22:c9:80.801a, length 43
21:11:36.953941 IP 0.0.0.0.bootpc > 255.255.255.255.bootps: BOOTP/DHCP, Request from 44:a8:42:41:b3:cb (oui Unknown), length 300
21:11:36.987690 IP adsl-99-99-99-1.dsl.lsan03.sbcglobal.net.49060 > 192.168.160.2.4789: VXLAN, flags [I] (0x08), vni 42
ARP, Request who-has 1.1.1.116 tell 1.1.1.22, length 28
21:11:36.989307 IP adsl-99-99-99-2.dsl.lsan03.sbcglobal.net.51752 > adsl-99-99-99-1.dsl.lsan03.sbcglobal.net.4789: VXLAN, flags [I] (0x08), vni 42
ARP, Reply 1.1.1.116 is-at 52:54:00:f1:5c:fd (oui Unknown), length 28
21:11:36.989448 IP adsl-99-99-99-1.dsl.lsan03.sbcglobal.net > adsl-99-99-99-2.dsl.lsan03.sbcglobal.net: ICMP adsl-99-99-99-1.dsl.lsan03.sbcglobal.net udp port 4789 unreachable, length 86
21:11:37.988504 IP adsl-99-99-99-1.dsl.lsan03.sbcglobal.net.49060 > 192.168.160.2.4789: VXLAN, flags [I] (0x08), vni 42
ARP, Request who-has 1.1.1.116 tell 1.1.1.22, length 28
21:11:37.990141 IP adsl-99-99-99-2.dsl.lsan03.sbcglobal.net.51752 > adsl-99-99-99-1.dsl.lsan03.sbcglobal.net.4789: VXLAN, flags [I] (0x08), vni 42
ARP, Reply 1.1.1.116 is-at 52:54:00:f1:5c:fd (oui Unknown), length 28
21:11:37.990253 IP adsl-99-99-99-1.dsl.lsan03.sbcglobal.net > adsl-99-99-99-2.dsl.lsan03.sbcglobal.net: ICMP adsl-99-99-99-1.dsl.lsan03.sbcglobal.net udp port 4789 unreachable, length 86
21:11:38.900969 STP 802.1d, Config, Flags [none], bridge-id 8001.00:1b:2b:22:c9:80.801a, length 43
21:11:38.990566 IP adsl-99-99-99-1.dsl.lsan03.sbcglobal.net.49060 > 192.168.160.2.4789: VXLAN, flags [I] (0x08), vni 42
ARP, Request who-has 1.1.1.116 tell 1.1.1.22, length 28
21:11:38.992301 IP adsl-99-99-99-2.dsl.lsan03.sbcglobal.net.51752 > adsl-99-99-99-1.dsl.lsan03.sbcglobal.net.4789: VXLAN, flags [I] (0x08), vni 42
ARP, Reply 1.1.1.116 is-at 52:54:00:f1:5c:fd (oui Unknown), length 28
21:11:38.992415 IP adsl-99-99-99-1.dsl.lsan03.sbcglobal.net > adsl-99-99-99-2.dsl.lsan03.sbcglobal.net: ICMP adsl-99-99-99-1.dsl.lsan03.sbcglobal.net udp port 4789 unreachable, length 86
21:11:40.820282 DTPv1, length 38
21:11:40.820312 00:1b:2b:22:c9:9a (oui Unknown) > 01:00:0c:00:00:00 (oui Unknown) SNAP, oui Cisco (0x00000c), pid Unknown (0x0003), length 68: 
	0x0000:  aaaa 0300 000c 0003 0000 0000 0100 0ccc  ................
	0x0010:  cccc 001b 2b22 c99a 0022 aaaa 0300 000c  ....+"..."......
	0x0020:  2004 0100 0100 0500 0002 0005 0400 0300  ................
	0x0030:  0540 0004 000a 001b 2b22 c99a 0000 0000  .@......+"......
	0x0040:  0000 0000 0000 0000 221e 4acc            ........".J.
21:11:40.906142 STP 802.1d, Config, Flags [none], bridge-id 8001.00:1b:2b:22:c9:80.801a, length 43
21:11:40.989743 IP adsl-99-99-99-1.dsl.lsan03.sbcglobal.net.49060 > 192.168.160.2.4789: VXLAN, flags [I] (0x08), vni 42
ARP, Request who-has 1.1.1.116 tell 1.1.1.22, length 28
21:11:40.991241 IP adsl-99-99-99-2.dsl.lsan03.sbcglobal.net.51752 > adsl-99-99-99-1.dsl.lsan03.sbcglobal.net.4789: VXLAN, flags [I] (0x08), vni 42
ARP, Reply 1.1.1.116 is-at 52:54:00:f1:5c:fd (oui Unknown), length 28
21:11:40.991371 IP adsl-99-99-99-1.dsl.lsan03.sbcglobal.net > adsl-99-99-99-2.dsl.lsan03.sbcglobal.net: ICMP adsl-99-99-99-1.dsl.lsan03.sbcglobal.net udp port 4789 unreachable, length 86
21:11:41.992657 IP adsl-99-99-99-1.dsl.lsan03.sbcglobal.net.49060 > 192.168.160.2.4789: VXLAN, flags [I] (0x08), vni 42
ARP, Request who-has 1.1.1.116 tell 1.1.1.22, length 28
21:11:41.994156 IP adsl-99-99-99-2.dsl.lsan03.sbcglobal.net.51752 > adsl-99-99-99-1.dsl.lsan03.sbcglobal.net.4789: VXLAN, flags [I] (0x08), vni 42
ARP, Reply 1.1.1.116 is-at 52:54:00:f1:5c:fd (oui Unknown), length 28
21:11:41.994280 IP adsl-99-99-99-1.dsl.lsan03.sbcglobal.net > adsl-99-99-99-2.dsl.lsan03.sbcglobal.net: ICMP adsl-99-99-99-1.dsl.lsan03.sbcglobal.net udp port 4789 unreachable, length 86
21:11:42.911127 STP 802.1d, Config, Flags [none], bridge-id 8001.00:1b:2b:22:c9:80.801a, length 43
21:11:42.994940 IP adsl-99-99-99-1.dsl.lsan03.sbcglobal.net.49060 > 192.168.160.2.4789: VXLAN, flags [I] (0x08), vni 42
ARP, Request who-has 1.1.1.116 tell 1.1.1.22, length 28
21:11:42.996522 IP adsl-99-99-99-2.dsl.lsan03.sbcglobal.net.51752 > adsl-99-99-99-1.dsl.lsan03.sbcglobal.net.4789: VXLAN, flags [I] (0x08), vni 42
ARP, Reply 1.1.1.116 is-at 52:54:00:f1:5c:fd (oui Unknown), length 28
21:11:42.996624 IP adsl-99-99-99-1.dsl.lsan03.sbcglobal.net > adsl-99-99-99-2.dsl.lsan03.sbcglobal.net: ICMP adsl-99-99-99-1.dsl.lsan03.sbcglobal.net udp port 4789 unreachable, length 86
21:11:43.314405 IP 0.0.0.0.bootpc > 255.255.255.255.bootps: BOOTP/DHCP, Request from 44:a8:42:41:b3:cb (oui Unknown), length 300
21:11:44.915808 STP 802.1d, Config, Flags [none], bridge-id 8001.00:1b:2b:22:c9:80.801a, length 43
21:11:44.993435 IP adsl-99-99-99-1.dsl.lsan03.sbcglobal.net.49060 > 192.168.160.2.4789: VXLAN, flags [I] (0x08), vni 42
ARP, Request who-has 1.1.1.116 tell 1.1.1.22, length 28
21:11:44.994908 IP adsl-99-99-99-2.dsl.lsan03.sbcglobal.net.51752 > adsl-99-99-99-1.dsl.lsan03.sbcglobal.net.4789: VXLAN, flags [I] (0x08), vni 42
ARP, Reply 1.1.1.116 is-at 52:54:00:f1:5c:fd (oui Unknown), length 28
21:11:44.995054 IP adsl-99-99-99-1.dsl.lsan03.sbcglobal.net > adsl-99-99-99-2.dsl.lsan03.sbcglobal.net: ICMP adsl-99-99-99-1.dsl.lsan03.sbcglobal.net udp port 4789 unreachable, length 86
21:11:45.518444 IP 0.0.0.0.bootpc > 255.255.255.255.bootps: BOOTP/DHCP, Request from 52:54:00:c8:84:fe (oui Unknown), length 300
21:11:45.569867 IP 0.0.0.0.bootpc > 255.255.255.255.bootps: BOOTP/DHCP, Request from 52:54:00:c5:1b:49 (oui Unknown), length 300
21:11:45.865613 IP 0.0.0.0.bootpc > 255.255.255.255.bootps: BOOTP/DHCP, Request from 52:54:00:80:cc:b9 (oui Unknown), length 300
21:11:45.994702 IP adsl-99-99-99-1.dsl.lsan03.sbcglobal.net.49060 > 192.168.160.2.4789: VXLAN, flags [I] (0x08), vni 42
ARP, Request who-has 1.1.1.116 tell 1.1.1.22, length 28
21:11:45.996445 IP adsl-99-99-99-2.dsl.lsan03.sbcglobal.net.51752 > adsl-99-99-99-1.dsl.lsan03.sbcglobal.net.4789: VXLAN, flags [I] (0x08), vni 42
ARP, Reply 1.1.1.116 is-at 52:54:00:f1:5c:fd (oui Unknown), length 28
21:11:45.996550 IP adsl-99-99-99-1.dsl.lsan03.sbcglobal.net > adsl-99-99-99-2.dsl.lsan03.sbcglobal.net: ICMP adsl-99-99-99-1.dsl.lsan03.sbcglobal.net udp port 4789 unreachable, length 86
21:11:46.923355 STP 802.1d, Config, Flags [none], bridge-id 8001.00:1b:2b:22:c9:80.801a, length 43
21:11:46.996682 IP adsl-99-99-99-1.dsl.lsan03.sbcglobal.net.49060 > 192.168.160.2.4789: VXLAN, flags [I] (0x08), vni 42
ARP, Request who-has 1.1.1.116 tell 1.1.1.22, length 28
21:11:46.998069 IP adsl-99-99-99-2.dsl.lsan03.sbcglobal.net.51752 > adsl-99-99-99-1.dsl.lsan03.sbcglobal.net.4789: VXLAN, flags [I] (0x08), vni 42
ARP, Reply 1.1.1.116 is-at 52:54:00:f1:5c:fd (oui Unknown), length 28
21:11:46.998207 IP adsl-99-99-99-1.dsl.lsan03.sbcglobal.net > adsl-99-99-99-2.dsl.lsan03.sbcglobal.net: ICMP adsl-99-99-99-1.dsl.lsan03.sbcglobal.net udp port 4789 unreachable, length 86
21:11:47.050716 IP 0.0.0.0.bootpc > 255.255.255.255.bootps: BOOTP/DHCP, Request from 52:54:00:80:cc:b9 (oui Unknown), length 300

